{
  "version": 1,
  "run_id": "work-agent-observe-001",
  "authority_settings_id": "work-agent-default",
  "mode": "observe",
  "evidence": {
    "artifact_path": ".kontourai/veritas/evidence/work-agent-observe-001.json",
    "artifact_digest": "2db8e73290eab9bf01eb3b56167ff0915ccf0f73bfc1f7f3acb4b8dbf6f49093",
    "timestamp": "2026-04-19T00:00:00.000Z",
    "source_ref": "refs/heads/main",
    "source_kind": "branch-diff",
    "source_scope": ["changed-from:origin/main", "changed-to:HEAD"],
    "components": ["delivery.github", "governance.root-manifests"],
    "triggered_evidence_checks": [".github/**", "root manifests"]
  },
  "governance": {
    "protected_standards_touched": true,
    "classification": "unknown",
    "human_review_required": false,
    "changed_paths": []
  },
  "reviewer_confidence_scale": ["low", "medium", "high", "unknown"],
  "prefilled_outcome": {
    "reviewer_confidence": "unknown"
  },
  "prefilled_measurements": {
    "time_to_green_minutes": null,
    "exception_count": 0,
    "false_positive_rules": [],
    "missed_issues": []
  },
  "notes": [],
  "missing_confirmation_fields": [
    "accepted_without_major_rewrite",
    "required_followup",
    "time_to_green_minutes"
  ]
}
