{
  "version": 1,
  "run_id": "veritas-repo-conformance",
  "authority_settings_id": "veritas-default",
  "mode": "observe",
  "evidence": {
    "artifact_path": ".kontourai/veritas/evidence/veritas-repo-conformance.json",
    "artifact_digest": "ef68cefe3e392c006cedd9621c82d0ee14050e377a0198914a881095f00c4cbb",
    "timestamp": "2026-04-21T22:00:00.000Z",
    "source_ref": "refs/heads/main",
    "source_kind": "explicit-files",
    "source_scope": [
      "explicit"
    ],
    "components": [
      "app.src",
      "docs.docs",
      "governance.guidance",
      "governance.root-manifests",
      "governance.schemas",
      "tooling.bin",
      "verification.tests"
    ],
    "triggered_evidence_checks": [
      ".veritas/**",
      "bin/**",
      "docs/**",
      "root manifests",
      "schemas/**",
      "src/**",
      "tests/**"
    ],
    "unresolved_files": [],
    "policy_results": [
      {
        "rule_id": "required-veritas-operational-artifacts",
        "classification": "hard-invariant",
        "enforcementLevel": "Require",
        "enforcement": "deny",
        "message": "The tracked Veritas operational artifacts must stay present so agents and reviewers share the same baseline.",
        "owner": "repo-core",
        "rollback_switch": null,
        "implemented": true,
        "passed": true,
        "status": "info",
        "summary": "All required repository artifacts are present.",
        "findings": []
      },
      {
        "rule_id": "required-veritas-cli-artifacts",
        "classification": "hard-invariant",
        "enforcementLevel": "Require",
        "enforcement": "deny",
        "message": "The shipped Veritas CLI entrypoints and package manifest must stay present.",
        "owner": "repo-core",
        "rollback_switch": null,
        "implemented": true,
        "passed": false,
        "status": "info",
        "summary": "Some required repository artifacts are missing.",
        "findings": [
          {
            "kind": "missing-artifact",
            "artifact": "package-lock.json"
          }
        ]
      },
      {
        "rule_id": "required-veritas-reference-artifacts",
        "classification": "hard-invariant",
        "enforcementLevel": "Require",
        "enforcement": "deny",
        "message": "The repo must keep the docs that explain the shipped Veritas surface.",
        "owner": "repo-core",
        "rollback_switch": null,
        "implemented": true,
        "passed": true,
        "status": "info",
        "summary": "All required repository artifacts are present.",
        "findings": []
      },
      {
        "rule_id": "required-veritas-schema-artifacts",
        "classification": "hard-invariant",
        "enforcementLevel": "Require",
        "enforcement": "deny",
        "message": "The shipped Veritas schema set must stay present and reviewable.",
        "owner": "repo-core",
        "rollback_switch": null,
        "implemented": true,
        "passed": true,
        "status": "info",
        "summary": "All required repository artifacts are present.",
        "findings": []
      },
      {
        "rule_id": "ai-instruction-files-synced",
        "classification": "hard-invariant",
        "enforcementLevel": "Guide",
        "enforcement": "deny",
        "message": "All required AI tool instruction files must contain the Veritas governance block.",
        "owner": "repo-maintainers",
        "rollback_switch": null,
        "implemented": true,
        "passed": true,
        "status": "info",
        "summary": "All required AI instruction files contain the canonical Veritas governance block.",
        "findings": []
      },
      {
        "rule_id": "prefer-veritas-routed-delivery",
        "classification": "promotable-policy",
        "enforcementLevel": "Observe",
        "enforcement": "advisory",
        "message": "Prefer keeping the tracked Veritas evidenceCheck and repo conformance integration surfaces present so changes flow through the documented operational path before review.",
        "owner": "repo-maintainers",
        "rollback_switch": "soften-veritas-route",
        "implemented": true,
        "passed": true,
        "status": "info",
        "summary": "All required repository artifacts are present.",
        "findings": []
      },
      {
        "rule_id": "no-console-log-in-src",
        "classification": "advisory-pattern",
        "enforcementLevel": "Guide",
        "enforcement": "advisory",
        "message": "Source files should not leave console.log diagnostics behind.",
        "owner": "repo-maintainers",
        "rollback_switch": "allow-console-log",
        "implemented": true,
        "passed": true,
        "status": "info",
        "summary": "No matched files contain forbidden pattern console\\.log.",
        "findings": []
      },
      {
        "rule_id": "canonical-veritas-vocabulary",
        "classification": "advisory-pattern",
        "enforcementLevel": "Guide",
        "enforcement": "advisory",
        "message": "First-contact Veritas docs should use canonical product vocabulary from CONTEXT.md.",
        "owner": "docs-team",
        "rollback_switch": "allow-vocabulary-drift",
        "implemented": true,
        "passed": true,
        "status": "info",
        "summary": "All matched files use canonical Veritas vocabulary.",
        "findings": []
      },
      {
        "rule_id": "repeatable-governance-uses-veritas-primitives",
        "classification": "promotable-policy",
        "enforcementLevel": "Guide",
        "enforcement": "advisory",
        "message": "Repeatable repo governance checks should be represented by Veritas primitives before they become local helper scripts.",
        "owner": "repo-maintainers",
        "rollback_switch": "allow-unrepresented-governance-script",
        "implemented": true,
        "passed": true,
        "status": "info",
        "summary": "Repeatable governance checks are represented by Veritas primitives.",
        "findings": []
      }
    ]
  },
  "governance": {
    "protected_standards_touched": true,
    "classification": "unknown",
    "human_review_required": false,
    "changed_paths": [
      ".veritas/GOVERNANCE.md",
      ".veritas/repo-map.json",
      ".veritas/repo-standards/default.repo-standards.json",
      ".veritas/authority/default.authority-settings.json"
    ]
  },
  "reviewer_confidence_scale": [
    "low",
    "medium",
    "high",
    "unknown"
  ],
  "prefilled_outcome": {
    "reviewer_confidence": "high"
  },
  "prefilled_measurements": {
    "time_to_green_minutes": 12,
    "exception_count": 0,
    "false_positive_rules": [],
    "missed_issues": []
  },
  "notes": [
    "This example is generated from the Veritas repo using its tracked .veritas config.",
    "The goal is to show a self-hosted report and standards feedback flow without making local evidence outputs part of the distributed package."
  ],
  "missing_confirmation_fields": [
    "accepted_without_major_rewrite",
    "required_followup"
  ]
}
